,sentence,label
2402,시발시발나새끼존나싫어,욕설
2403,아 시발 대체 뭘 어떻게 공부해야하는거냐 시발..,욕설
2404,씨발섹스,욕설
2405,지구 씨발년아 걍 멸망해버려 ㅅㅂ,욕설
2406,이씨발 돌아가자,욕설
2407,진짜 이래서 살인 저지르나 싶을 정도로 살인충동 든다ㅆㅂ 내가 세상에서 제일 싫어하는게 내 돈 가지고 장난질 하는 건데 40만원 씩이나 쳐빌려 가놓고 돈 없다고 배째라는 식으로 나오네??? 어떻게 6개월 동안 돈이 계속 없냐???? 빌려줬던 내가 미친새끼가 맞긴 하지만 적어도 갚으려는 의지라도 보여야지 씨발ㅋㅋ 진짜 배를 째버릴까 개새끼 40만원짜리 인생교과서 샀다고 생각하려고 해도 내가 알바로 거의 50시간 뺑이 친 걸 생각하면 너무 좆같아서 그럴 수도 없고... 하.. 시발 진짜...,욕설
2408,시발 과제 그만 좀 내세요 제발 강의력도 안좋으면서 과제만 오지게 주네 진짜 ㅋㅋㅋㅋㅋㅋ 잘 나오지도 않는 거만 과제로 오지게 내고 시발 교양 과제때문에 전공공부를 못해요 시발,욕설
2409,아오시발정신차려라시발제발미넞ㅇ아정신차리자제발나이렇게살면시벌대책없다개븅신아 제발 아오시발내인생좆같네어디서부타잘못됐냐겟쒸발,욕설
2410,그래씨발 알았다,욕설
2411,짜증난다진짜아니왜안돼냐고시발시바리사미하사비핫ㄹ,욕설
2412,ㅅㅂ개좆같다 진짜 열받는데 어디 아오시발 왜 답장안하냐 개새끼야 답장해라 시발 아오진짜개좆같네 존나열받네 답장해라시발 성의없게보내도 답장은 해라 시발 ㅠ,욕설
2413,자꾸 니 필요할 때만 연락하지마 씨발련아 니가 그러니까 소외되는거지 제발 니 행동좀 돌아봐 병신년이ㅋ쿠ㅜㅠㅠ못배운티내지마 존나 불쌍한 새끼,욕설
2414,시발 존나 좆같다 다 뒤져라,욕설
2415,씨발 좆같아 진짜,욕설
2416,아 씨발 섹스하고싶다 씨발,욕설
2417,새벽마다 소리지르면서 게임하는 옆집 새끼 죽여버리고싶다,욕설
2418,개빡쳐 황소고집 오져 진짜 꼭 너같은 사람이랑 같이 일 해봤으면 좋겠다 ㅋㅋㅋㅋㅋㅋㅋㅋ,욕설
2419,대가리가 비었으면 눈치라도 챙겨 병신아 지가 선빵 때려놓고는 인성운운하네,욕설
2420,존나 싫다 시발 ㅋㅋㅋㅋ개같은 인간들시발,욕설
2421,과제 좆같네 씨바 과제 양이 존나 많아서 사실 내가 너무 열심히 살고 있는 게 아닐까 자기성찰했다 씨발씨발 이랬는데 점수 안주기만 해봐 아 씨발~~~~~~인생~~~~~~~,욕설
2422,아 씨발 공부하기 존나 싫어 할꺼 오지게많아 왜이렇게 할께 많아 씨발? 나 미쳤니 수강 신청 왜이렇세 많이 했어??? ^^ 아 교수고 나발이고 다 싫어 팀플 존나 싫어 좆같아 그냥 개인과제하면 되지 왜 팀플을 처하고 지랄이야 안그래도 만나서는 못하는데? 너가 생각하기에 온라인 발표가 좆도 잘될꺼라고 생각해? 한번도 안만든 사람들이 발표준비를 성실하게 잘 할거라고 생각하냐고ㅠ아아애아아가라라가가 씨발 존나 빡쳐 그냥 기말 끝나고 방학 왔으면 제발 아아아가앙아ㅏㅇ 짜증나,욕설
2423,씨-발 잼그랩 그딴식으로 할꺼면 손가락 잘라라,욕설
2424,아씨발실시간강의진짜개좆같네 플랫폼통일이라도하든가 지하고싶은대로 누구는이거누구는저거 나보고어쩌라고씨발진짜개좆같네온라인강의 수업전에lms로공지라도좀띄워봐씨발ㄴ,욕설
2425,아 싸강 존나 밀렸다 시발... 시발... 시... 발...,욕설
2426,음 어쩐지 사장 기분이 안 좋아보이네 ㅎ 여태 보고해도 연락 잘 안 되다가 급발진 오졌다리~ 월급날인데 월급이나 보내주고 일 시켜라 맨날 야근하는데 박봉에 복지도 ㅈ같다,욕설
2427,아앙 섹스 아 찍,욕설
2428,시발새끼 때문에 잠도 안온다진짜 인생 다 망쳐놓고 조져버리고싶다,욕설
2429,좋아하는 여자한테 잘 보이고 싶으면서 돈얘기는 왜 하니?ㅋㅋㅋㅋㅋ답도 없다 진짜 없던 정도 다 떨어짐,욕설
2430,진짜 존나 싫다ㅋㅋ네 주제를 알아,욕설
2431,시발 얼굴도 모르는 사람이 지나가면서 몸매 평가함 ㅈ같네,욕설
2432,으 진짜 제발 저런 사람 인생에서 안만나게 해주세요 씨발,욕설
2433,이 개새끼들앜ㅋㅋㅋㅋ 진심 이중잣대 좀 그만 들이밀어 아이돌이 죄야? 왜 다른 거 뜨니까 그건 싸악 모른 척 하면서 아이돌한테만 그래? ㅋㅋㅋㅋㅋㅋㅋㅋ 중범죄를 저지른 것도 아닌데 활중해라 탈퇴해라 자살해라 국민청원에 승리 취급까지 한 건 너무했잖아! 진짜 뇌절했냐 그리고 기레기들아 ㅋㅋㅋㅋㅋㅋㅋㅋ 쟤네가 양성 확진자도 아닌데 무슨 너네가 뭐라고 무슨 권리로 일개 기자가 동선이라면서 확실하지도 않은 걸 까 ㅋㅋㅋㅋㅋㅋㅋㅋㅋ 개웃곀ㅋㅋㅋㅋㅋㅋㅋㅋ 확진자 동선도 그렇게 세세하게 안 까. 진짜 다들 그렇게 이중잣대 들이밀고 선택적 비판 하는 인간들 다 돌려받아라 제발,욕설
2434,미네르바 이딴 개씨잫샃은 서 누사 처 만들었오 개씨발 이깐 슬을 써서 학샐한테 도움이 뭐가 되냐고 걍씨발 존아 내씹좆도씨발좆새씹씹씨발좆씹좆돚비효율적인 개씨발강의 좆씨발 개씨발,욕설
2435,애미씨발 진짜 이딴 과제로 뭔 놈의 지랄맞은 교양을 함양해? 존나 지랄하지 마,욕설
2436,질질 짜면서 말도 못하고 울긴 왜 울어 씨발새끼가,욕설
2437,씨발 개빡쳐,욕설
2438,야이 개잡노무시끼야 너는 내가 느그 집에 불행만이 연이어 일어나기를 조빠지게백일기도드린다,욕설
2439,과제 시발 너만 없었으면 삶의질 2배는 상승이야 시발,욕설
2440,과제 그만내 좀 시발아 진짜작작좀 쳐내라 개빡치네지들 수업만 있는줄 아나 강의력도 좆같아서 안그래도 빡치는데 과제는 존나게도 내요 ㅅㅂ돈지랄돈지랄 시발 아오,욕설
2441,으아아ㅏ아아ㅏㅇ아ㅏ불면증 ㅅ바ㅏㅏㅏㅏㅏㅠㅠㅠㅠ,욕설
2442,아 씨발 진짜 다 뒤졌으면,욕설
2443,글캠 스통이 건대랑 겹치는건 팩트라니까? 새끼가 통계자료를 보여줘도 현실부정하면서 국숭국숭하고 자빠졌네,욕설
2444,씨 발 새 끼얼른 취업해서 이 새끼 얼굴 안보고 살게 해주세요 제발요,욕설
2445,과제 작작 내 ㅅㅂ 5일째 새벽 5시 넘어서 쳐자네 과제 검사도 레포트 피드백도 안해주면서ㅅㅂ,욕설
2446,끊임없는 군림자로 정신을 갉아먹는 버러지. 그 행보와 언행은 가히 충격적!,욕설
2447,에버랜드 가고 싶다!!!!!!!!!!!!!!! 씨발!!!!!! 존나 마렵다!!!!!!! 지금 브금 듣는데 미치겠다 존나 가고 싶어!!!!!!!!!!!!!!!! 에버랜드 5개월째 못 가고 있다!!!!!!!!! 진짜 끝나기만 해 존나게 조져준다!!!!!!!!!!!!! 근데 씨발 지금 쳐가는 새끼들은 뭐하는 년놈들이냐 집에 있어 개새끼들아!!!,욕설
2448,씨발 일 맡기로 했으면 제발 책임지고 좀 해라 버스타겠다는 것도 아니고 존나 아무것도 안하네,욕설
2449,아 시발 진짜 나 새끼 죽이고 싶다 맨날 새벽 3시 넘어서까지 폰질하고 정오에 해가 중천일 때나 일어나서 하는 짓이 고작 기한 내에 제출해야 하는 과제 대충 때우기이고 집안 재산 야금야금 축내는 버러지 새끼 진짜 ㅠㅠ 공부라고는 30분도 제대로 안하는 한심한 놈!!!!,욕설
2450,알바하는데 직원 씨발년 죽었으면 좋겠다 ㅅㅂㅅㅂ  존나 나만 꼽줘시발련이 얼굴 좆같이 뭉개진게 개지랄떠는데 와 존나어이털려ㅋㅋㅋㅋㅋㅋㅋㅋㅋ 서른넘어처먹고 일하는데가 이딴덴데 뭐믿고 나대지? 죽었으면 좋~겠~다~~~^~~^,욕설
2451,이쪼끄만 방에서 동거를 하다니...매일매일 참 시끄럽구나 옆방년아...인간적으로 12시 넘으면 좀 닥쳐야지아가리아가리 저 아가리 진짜 패고싶다경희대 후문 이마트 맞은편 건물에 사는 너혹시라도 이 글을 본다면 좀 닥쳐라좋게좋게 말했으면 알아들어야지 썅년이,욕설
2452,씨발 진짜 .. 존나빡친다ㅜㅜ 씨발!!!!,욕설
2453,야이씨발개좆같은 씹새끼야 과제좀 그만내 씨발 좆같은 개 씨발 으아아아아아아아아아아아,욕설
2454,아 ㅆㅂ 게이클럽 새끼들 때문에 이제 끝났다 생각했는데 시이이이발 계속 이 지랄해야하네.,욕설
2455,부탁인데 제발 연락좀 그만해 너 시발 좆같다고 존나 역겨워 내가 지금 싫은티를 얼마나 냈는데ㅋㅋ 모르는척 그따구로 행동하는거 진짜 병신같아 ㅣㅅ발련아  그냥 나가 뒤져,욕설
2456,씨발련이 지가 잘못하고 아무런 말도 없이 행동하냐 개새끼야,욕설
2457,씨발것들 머리를 달고있으면 생각이란걸 좀 해라,욕설
2458,씨앙놈이 진짜,욕설
2459,시발 과제 존나 많아족같애 안제끝나 십발시발끝내도 시험이네 시벌사람답게 좀 살고싶다 며칠째 마리안감아서 머리가렵다 시발,욕설
2460,야 진짜 개년아 넌 어떻게 사람에 그럴수있냐 이제와서 아니라고 하면 다야? 시발 원래 관심 너한테 1도 없었는데 씨발 네가 먼저 다가온거잖아 어이없네 존나 멋진 새끼가 그 사이에 생긴거냐 시발 좆 같네 아니 시발 그동안 보였던 행동은 시발 100프로 다 내 착각이구나 내가 시발 도끼병에 시발 뭐든지 가져다 부치니까 네 년은 하다도 잘못한거 없는데 그 동안 나는 너가  호감을 준줄 알았지모야 내가 호구였네 시발 그렇게 연애가 하고 싶어? 발정났어? 시발 남자가 그렇게 좋아?????? 아니 시발 내 주변에 왜 알짱 거려가지고 사람을 피곤하게 하냐 네년 없을 때가 훨씬 좋,욕설
2461,씨발,욕설
2462,씨발.안그래도 살기 싫은데 그 새끼들 덕분에 더 살기 싫어졌네.,욕설
2463,개씨발년 생각이 없으면 닥치고 있을 것이지 존나 입털어대면서 선동질하네,욕설
2464,씨발 진짜 노답이다 ㅋㅋㅋ,욕설
2465,시발 병신들 ㅈ같아서 같이 안한다,욕설
2466,아씨이발~!!!!!!!!!!!!!!!!!!!!!!!!!!!!!!!!!!!!!!!! 서평 ㅈㄴ 어렵다!!!!!!!!!!!!!!!!!!!!!!!!!!!!!!!!!!!!!!!!!!!!!!!!!!!!!!!!!!!!!!!!!!! 난 개 병신인가봐!!!!!!!!!!!!!!!!!!!!!!!!!!!!!!!!!!!!!!!!!!,욕설
2467,씨발새끼 차별하는 것도 아니고 존나 빡치네,욕설
2468,아 개씨발,욕설
2469,넌 씨발 조주빈정도로 개 씨발련이야 나가 뒤져,욕설
2470,개씨발련아 닌 무조건 좆망할거다 그렇게 좆같이 행동하니까 모쏠이지 병신아; 니 잘난거없으니까 뭣도 아닌걸로 자랑좀 쳐하지마;병신새끼가 진짜ㅋㅋㅋㅋㅋ니 엄마가 그렇게 가르쳤냐?무슨 내로남불이 이렇게 오지냐 사람새끼가ㅋㅋㅋㅋ?가는말이 고와야오는말이 곱다는 속담도 모르냐? 제발 부탁인데 알짱거리지도 말고 그냥 사람들한테 버림받아져서 뒤져 제발,욕설
2471,쎼발,욕설
2472,김인철 개새꺄.....넌 사람도 아니야 새끼야....,욕설
2473,시발ㅠ 헷갈ㄹ게 나한테 잘해주지마ㅠㅜ 진짜 너 때문에 헷갈려 죽겠고 마음 뒤숭숭하고 얼마나 힘든지 알아? 그 늦은 시간에 왜 우리 동네로 술을 마시러 와ㅠ 개같은놈아 진짜 시발 나한테 사귀자고 할거 아니면 진짜 그러지마 나쁜 새끼야,욕설
2474,아 좆같네 빠른 재기 시급하다 개놈들,욕설
2475,아니 씨불 교수님!!!!! 교수님!!!!!!!!!!!!!!!!!저 새내기에요 아직 영어로 중간 대체 레포트 쓸 실력이 아니라구요 아시겠어요???? 자료 조사도 다 영어 자료 읽어야하는 주제를 주시면 제가 어케 제정신으로 하겠냐구요!! 씨불 언제 다하냐 오늘 안에 끝낼려고 했는데 하하하핳,욕설
2476,씨발 찾을수도 없는거 어떻게 조사하라는거야 존나빡친다 시발,욕설
2477,너가 쇈차노을 거라며 너가 친절하가 그랳자노라 시잘 존나 괜찮다며 잘해준다며 잘 준다며 찬절할거라며 근데 시발 성격 사이코패스 과파괒나ㅗ라 장난 하냐고오ㅗㅗㅗㅗ 너때문에 이게 뭐냐고 ㅠㅠㅠㅠㅠㅠㅠㅠㅠㅠㅠㅠㅠㅠㅠㅠㅠㅠㅠㅠㅠㅠㅠㅠㅠㅠㅠㅜㅠㅠㅠㅠㅠㅠㅠㅠㅠㅠㅠㅠㅠㅠㅠㅠㅠㅠ 잘난하냐고 진짜 ㅠㅠㅠㅠㅠㅠㅠㅠㅠㅠㅠㅠㅠ,욕설
2478,나는 코로나 걸리기 싫다구요 왜 학교 오라는건데 십팔 자취방도 양도했다구~~~~~~~~~한달동안 내 숙식비 제공해줄껴??????,욕설
2479,씨발 살기싫다 진짜,욕설
2480,씨발 내가 과제하러 대학 왔나?,욕설
2481,시발 말투하고는 싸가지 존나 없어,욕설
2482,씨발씨발씨발 우울증 나가뒤져씨발 우울증아 우리 사이좋게 잘 지냈잖아 오늘따라 왜 그래 씨발 진짜,욕설
2483,너나 열심히 시위해봐 가서 총이나 맞고 뒤지시던지,욕설
2484,기분 재기함 ㅉ,욕설
2485,모기 개씨발 호로년아 넌 잡히면 진짜 하나하나 뜯어서 죽인다,욕설
2486,야이씨발ㅈ같은년아 개씨발집중ㅈㄴ안되네,욕설
2487,대면강의 개씨바아아아아아아아아ㅏ아아어ㅓㅇ어ㅏ아아아아ㅏ아아으아아ㅏㅇ아ㅏ알이런 씨2222222222222바아아아아알,욕설
2488,시발....공부 언제ㅠㅐ 해 전나 ㅅㅂ외대 하,욕설
2489,씨발,욕설
2490,행정법 소송파트 개ㅈ같네 씨발 머가리에 하나도 안 들어와,욕설
2491,시발 갵아네 진짜 개씨발,욕설
2492,컴퓨틴사고 개싫다 진짜 오답입니다오답입니다오답입니다오답입니다 ㄹㅇ 정병걸릴것같음,욕설
2493,씨발 로딩 존나느려,욕설
2494,씨발 윗집 애새끼 ㅈㄴ 뛰어다니네 개빡쳐아주 집을 횡단해라 마당에서 놀아,욕설
2495,게이새끼야 처신똑바로 해 내가 니 엄만줄 아냐? 좆달린 새끼가 어디 사람 등 쳐먹어 병신아 니가 그러니까 남들이 니 싫어하는 거야,욕설
2496,아아아아아ㅏㅇ아아앙앙아앙악 시발ㄹㄹㄹㄹㄹㄹㄹㄹ 이게 소외감인거 알고 다 아는데 시발ㄹㄹㄹㄹㄹㄹㄹㄹ하ㅋㅋㅋㅋㅋㅋㅋㅋㅋㅋㅋㅋㅋㅋ박탈감?ㅋㅋㅋ허탈함 파티네 말 한번 해주는게 어디 어렵냐 지금껏 ㅋㅋㅋ신경쓰고 한건 어디 갔냐ㅋㅋㅋㅋ시붕당ㅋㅋㅋㅋㅋ그래놓고 전화는 왜 하는데 시벌ㅋㅋㅋㅋㅋㅋㅋ짜증나 시벌ㄹㄹㄹ라ㅏㄹㄹ랄ㄹ랄ㄹ랄ㄹㄹ랄,욕설
2497,와 이런 게시판이 있었네 씨발 존나 개좋다 씨부랄 젖같은거 와 너무 좋아 이 개씹한 오 씹창 개좆네 씨부랄것 !!!!!,욕설
2498,아 출석못했다 좆됐네 씨발 악,욕설
2499,쀼의 세계 개시발!!!!!!!!!!!!,욕설
2500,씨발씨발씨발씨발,욕설
2501,페미니스트 자청하는 인간들아 혼자 똑똑한 척 오지게 떠는데 논리력이라고는 씨발 좆도 없고 제대로 아는 것도 없으면서 말문 막히면 언제 봤다고 씨발 근보도 없는 개호로년들이 어디다 대고 반말이냐 선민의식 시발 아주 꼴 사나워서 진짜 가만히 있는 사람을 남자라는 이유로 헐뜯고 비난하고 재범이 찌찌 파티는 그래도 되는 거고 위근우인지 뭔지 기레기 새끼가 지가 뭔데 무슨 자격으로 고인의 권리를 운운하고 악플로 사람을 죽게 만들었으면 알아서 대가리처박고 죄책감을 느낄 것이지 시발 여자면 뭐 살인 저질러도 면죄부라도 받아야하나봐? 네놈들 하는 꼬락서니랑 히틀러 새끼 아리아인의 ,욕설
2502,니들 코로나때문이 아니라 걍 집에 있고 싶어서 싸강계속 하자 하는거잖아 위선떨지마,욕설
2503,시발 매너 좀 지켜라 진짜 ㅋㅋㅋㅋㅋㅋㅋㅋㅋㅋ,욕설
2504,씨발 좆같은 인생 왜태어났지,욕설
2505,시발 수업 개같이하네 개씨발 존나 듣기싫어시발,욕설
2506,씨발 진짜 개같은것들이 살살기면서 사람 건드는게 뭐있네 내로남불 새끼야 옆에서 떠받드는척 시녀짓만 하니까 니가 회사에서 사람대접 못받고 일하는거야 븅신아 말을 쳐해도 못알아쳐먹네 남일에 좀 눈치없이 끼어들지마 피해입은건 난데 니가 왜 중간에 껴서 왈가왈부를 하냐고 가만히 있으면 반은 가니까 상황 모르면서 남편들지말라고 좆같아 진짜말만 예쁘게 꾸며서 하면 다 욕이 아닌줄 알아 좆같은 년이 내가 욕을 했냐? 그동안 일처리는 미국 간 수준으로 해놓길래 다음에는 그러지말라고 한마디만 말했다 시발ㅋㅋㅋㅋㅋㅋ그걸로 질타 ㅇㅈㄹ할거면 관두던가 왜 좆목은 혼자 다하면서 붙어있는거,욕설
2507,개빡쳐진짜나 몇시에 시험본다 그러니까 조용히 해달라고 미리 말했고노트북으로 시험치는데 동생년이 와이파이 전원 꺼버림..ㅋㅋ하ㅋㅋㄱㅋㅋㅋㅋㅋㅋㅋㅋㄱㅋㅋㅋㄱㅋㅋㅋㅋㅋ시험창에서 튕겨나감 결국 허겁지겁 마무리는 했지만 엄마랑 동생 태도가 너무 뻔뻔하다ㅎㅎㅎ동생은 몰랐다고 내빼고 엄마는 앤 모를수도있지~ 하니까 개빡쳐 너도 당해봐 썅 아직도 화나네,욕설
2508,좆같은 인생 개같은 학교,욕설
2509,씨발~~~~~~~~~~~~!!~~~!!!! 과제 안일하게 미루고 위기감 느꼈을 대 나보다 더 심각한 애 보면서 위로하는 나 진짜 뒈져버려~!~~!~~~~,욕설
2510,잣같다 시발 뭐 병신같은 새끼들밖애 업ㅎ너 시벌것등 어휴 족같은 것들아 나자신 힘내고 걱정말고ㅠ다잘될거야 좃강은 것들은 다 죽어버리고 다 망해라 뒤로 넘어져도ㅠ코깨지고 앞으로 넘어지면 발기부전 걸려라 시발,욕설
2511,suck ur asshole bitch. ur fuck'n pennis will cut down and drop by your lips. hell up u shit.,욕설
2512,아 시발 미친 ㅠ 이렇게 허무하게 무단 결석하는 게 어딨어ㅠㅠㅠ 나새끼 그때 왜 잤냐ㅠ 최소 알람은 맞춰 두고 자지 그랬어ㅠㅠㅠㅠㅠ 내 잘못이라 어디 대고 욕도 못하고 돌겠네 ㅠ,욕설
2513,아 좆같네 머가리 빻은 새끼들 느개비 후장에 김칫독 파묻고 잘 익으면 쫙쫙 찢어서 밥에 얹어먹을 새끼들,욕설
2514,옆집 새끼야..닭소리좀 그만내라 씨발놈아좀 닥치고하던가 피방을 가 밤낮으로 지랄이야,욕설
2515,존나싫어,욕설
2516,병신같은 새끼 씨붤 존나 싸가지 없네,욕설
2517,왜 나한테만 지랄이야,욕설
2518,난 내가 제일 좆같아... 살고 싶지 않다 씨발,욕설
2519,하 시발 잘려고했는데 과제때문에 잠 다 깻네 ㅅㅂㅂㄱㅅㅂㅅㅂㅅㅂㅅㅂㅅㅅㅂㅅㅂㅅㅂㅅㅂㅅㅂㅅㅂㅅㅅㅂㅅㅂㅅㅂㅅㅅㅂㅅㅂㅅㅂㅅㅂㅅㅂㅅㅂㅅㅂㅅㅅㅂㅅㅂㅅㅂ,욕설
2520,^^ㅣ바 뭐이딴주제로분량은이만큼존나많이개시발아아아ㅏ아아아아어아아아어ㅏ아어어더더더어어어어우과제존나시러,욕설
2521,세상에 신이 어딨냐 멍청한년아ㅋㅋㅋ,욕설
2522,ㅅㅂ인생왜사는지몰겠다 시이발~~~~~~,욕설
2523,씨발 진짜 애미 뒤진 컴퓨팅 이 좆같은 걸 내가 왜 해야 되는건데 씨발새끼들아 진짜 애미 뒤진 오답입니다 뜰 때마다 컴퓨터 부숴버리고 싶어 미칠거 같다 좆같아서 이제 안 한다 개씨발거 교수도 존나 불친절 해서 수업 뿐만이 아니라 공지도 제대로 가르쳐주는 거 니미 좆도 없고 진짜 개빡치네,욕설
2524,아 시발 좆같은 새끼들,욕설
2525,머리빈새끼 다싫음,욕설
2526,여즘 개빡쳐서 여기서 욕하러 들어왓다가 뭔가 내가 하려던 말이랑 비슷한 거 보고 걍 공감하고 나가고잇음 다들 비슥한 걸로 개빡치는구나,욕설
2527,다죽여버리고싶다존나대가리에든것도없으면서맨날좆논리들이대는 지능낮은새끼들참수해야해씨발뭐라도되는줄아는새끼들떼쓰는게다섯살애기보다더징징거리네씨발사지가찢길놈들,욕설
2528,시발시발 존나 짜증나,욕설
2529,진짜 좆같은새끼 세상 좋은사람인척 다하면거 나한테는 늘 좆같이 징징대는새끼,욕설
2530,멍청한 새끼들 존나싫어..진짜존나싫어진짜씨발..,욕설
2531,좆같네 시발 왜나함테만 그래아리발진짜,욕설
2532,말좀이쁘게해라 교수년아 씨발 누가 링크 타고가는거 몰라? 애미없는새끼가 가정교육 독학했나 뭣도모르고 지혼자 띠껍다는 투로 찍찍 싸대네 씨발련이 니같은새끼는 코로나걸려 뒤지는게 사회에 득이 되는 길이다 좆같은년아 니가 문의하라고 이메일 올려두고 왜 지랄이야 대가리에 똥만 찬 꼰대새끼가 애미없이자란거 홍보 존나하네 개년이,욕설
2533,시발,욕설
2534,아오씨발 글쓰기 과제 좆같아,욕설
2535,10을 ㅣ전달하면 0.5라도 전달되는건지안되는건지도 불투명하고 왜 그따구로 전달하냐고 따짐 존나 미라클,욕설
2536,다 사바사인거지 절대적 기준이 어딧어 하하 다 상대적인거야시발그래도인간이기본이있여야할거아야녀시발기본적으로말을처하면알아처먹는건있어야지머가리가잇어없어쉬벌역지사지일케안되는사람존나처음봄새로움이존나지나치다이건대체뭐가원인으로멍청한건지감도안잡혀선천지능인가요,욕설
2537,하시발개좆같네,욕설
2538,지만 세상에서 제일 불쌍한거 같아해서ㅋㅋㅋㅋㅋ 지앞에서 누가  힘들다고 하는 꼴 못봄ㅋㅋㅋㅋ근데 누가 자기한테 똑같이하면 존나 화냄ㅋㅋㅋㅋㅋ 얘만큼 존나 역지사지 못하는 년 못봤다 이건 진짜 지능문제라고밖이 못하겠음 씨발 개멍청한년 제발 뒤져죠라,욕설
2539,진짜 이기적인년인데 착한척은 개씨개함근데 시발 하는 꼬라지가 존나 다 눈에보여가지고 이기적일거면 머리라도 잘굴려서 티라도 내지말지 개멍청한 소리 에블데이 지껄여대면서 남 나쁜년 못만들어서 혈안ㅇ임 시발롬이 존나 니빼고 니가 질 좆병신인거 다알아 걔가 너 받아주는 거는 너 잘 몰라서 그래 시발ㅋㅋㅋㅋ이제 갸한테 붙어서 내욕 쫀나게 해대다가 또 함 내귀에 들리기만 와바라 씨발련ㅂ,욕설
2540,개지랄맞은년짖짜존나싫다 제발 기본은 하자 기본선좀지키자 제발 모리가 앗으면 생각을하자짖ㅁ저좆ㄱ병신같은ㅇ년,욕설
2541,씨발진짜멍청하고좆같은년짐짜 연 어캐끊지시발,욕설
2542,시발진짜좆같은년좆같은거좀만봐주려고하멵ㅎㄴ나불쑥붊숙좆같게해서씨발년뒤죳으면졸겟음,욕설
2543,씨발 좆같은새끼들 너무많아 개싫어,욕설
2544,멍청한데 영악한새끼 뭔지아냐시발 존나 멍청한데 시발 머갈 텅텅 좆병신새낀데 존나 불쌍한척 처량한척 애지게해서 나만 나쁜년되기 싫어서 받아주고 있는 꼴이 좆같다,욕설
2545,씨발씨발 플랙스 개열심히 공부했는데 시발,욕설
2546,수업시간좀 딱딱 지켜라 씨발,욕설
2547,씨발씨발씨발씨발 아침부터 기분 나쁘지만 난 그럼에도 불구하고 기분좋게 과제해야지 걍 씨바ㅏ무시하고 수업듣자^^,욕설
2548,니가그러고도교수냐씨발...아답답해,욕설
2549,하 ㅇㅇ님 진짜 씨발아 존나 하나부터 끝까지 다 마음에 안 들어 씨발,욕설
2550,개 같은게 니나 잘해 병신아,욕설
2551,지들이 뭔데ㅠㅠㅠㅠㅠㅠㅠㅠㅠ시발 좆같애 진짜,욕설
2552,씨발 개빡친다,욕설
2553,야 이씨발련 나쁜년아 이중적인 잣대 치우고 니가 평생 불행 했음 좋겠어 씨발 니 가족들까지도 썅년아,욕설
2554,애비뒤진새끼야 열살어린나한테찝적대지말고 그렇게 박고싶으면 니애비후장에 박으셈 니랑 느개비 느갈배랑 쓰리썸 개꿀~~,욕설
2555,으아아아 시발 첫면접 시발!!! 개떨린다ㅠㅠㅠ살려줘ㅠㅠㅠㅠ빨리 24시간 지나있어서 케이크 먹고 있고 싶다 투썸 아이스박스 먹을거야,욕설
2556,하 존나 착한척 오진다ㅋ 그래봤자 니 수준은 거기야존나 자기가 하는 행동은 생각안하고 무조건 남이 잘못했댘ㅋㅋ 니도 똑같은 행동 하고있거든?ㅋㅋㅋㅋ 전나 개웃기넼ㅋㅋㅋ,욕설
2557,아 씨발 ㅈ 도모르겠어 논문은 무슨 논문을 찾아보라는거야... 씨발씨발,욕설
2558,왤케 세상에 ㅈ같은 인간이 많을까 사람이 다 싫어진다,욕설
2559,씨발.... 존나지겨운 정신병 약좀그만먹고싶다 마음편히살고싶다 제발날좀놔줘,욕설
2560,아니 병신아... 니 관심 하나도 없고 연락하기도 싫다고.. 왜 자꾸 연락을 쳐 하지 진짜 눈치 뱃살에 다 쳐 넣었나,욕설
2561,나는 이해력 존나 딸리는 난독증 저능아는 상대안함 저격 올리는 수준 시발ㅋㅋㅋㅋㅋ딩초임?,욕설
2562,군대 씨발씨발씨발씨발,욕설
2563,코골이 애미터진 씨발 개씹련아,욕설
2564,시비털고 지랄이네 씹또라이새끼가,욕설
2565,자퇴하고싶다 시발,욕설
