,sentence,label
3973,이건 시발 진짜 탄핵감이지.,욕설
3974,ㅈ같네 시발.,욕설
3975,진핑이랑 재앙이를 어떻게 찢어 죽여야,욕설
3976,잘 찢어 죽였다고 소문이 날까,욕설
3977,전라도 애들 또 지랄...발작하네...,욕설
3978,즈그들 박정희 가튼 인물 없음이 원인...,욕설
3979,하태경 새끼 저렇게 좌빨 까다가 항상 결국엔 분탕침. 엑스맨이야 저새끼.,욕설
3980,존나 옷이 쌀독에 쌀알 들었듯이 옷장안에 있나벼,욕설
3981,자본주의 아닌 나라로 떠남되지 선동해서 적화시킬려고 저지랄떠냐 ㅆㅂ,욕설
3982,씨발 오또께,욕설
3983,몇년 전인가 어떤 병신은 한식대첩에 나오는 아줌매미들보고 셰프라고 입에 거품물고 달려들던데 ㅋㅋㅋㅋ,욕설
3984,깜빵은 무슨 저씹새끼는 참수해야돼,욕설
3985,애미년 마누라년 자식년놈들도 연좌제물어서 같이 참수해야지,욕설
3986, 사돈에 팔촌까지 죄다 싹다 잡아다 모가지 질겅질겅 썰어버리고,욕설
3987,대가리는 탱크궤도에 깔아서 뇌가 질질 바닥에 흥건하게 만들어야 내 속이 풀리겠다,욕설
3988,저게 자칭 진보 실상 친북종북 좌빨들의 실체다,욕설
3989,신속대응팀이란다 에휴 씨발,욕설
3990,아오 씨발ㅋㅋ 존나웃기노,욕설
3991,자네에게 나와 섹스할 자격능 주노라.,욕설
3992,전라도 새끼들은 전부 가스실에 처넣어야됨,욕설
3993,좌좀 병신새끼들은 뒤지기만하면 우상화되네 ㅋㅋ,욕설
3994,베트남은 씨발려나,욕설
3995,닥처라 토착 조선족 짱깨 십새끼야,욕설
3996,내가 대통령해도 너새끼보단 잘하겠다 씨ㅡ발련아,욕설
3997,추미애 같은 년이 판사도 하는 나라였다,욕설
3998,자유한국당은 일단 늙은새끼들부터 쳐내야함.,욕설
3999,지역구나 잡고 있는 쓸때도 없는 개새끼들,욕설
4000,뭐야 저게 시발 김정숙 본인이 고소 한거냐?,욕설
4001,아오 시발 말 못 하니까 존나 답답하내,욕설
4002,그렇게 따지면 전라도 새끼들은 돈 받아 쳐먹을려고 세월호 학생들 죽인거네 ㅋㅋㅋ,욕설
4003,저런 머가리로 설대가면 머하노 ㅉㅉ,욕설
4004,일단 살아라 시발년아 노가다라도 해 샹년이 홍어새키들도 사는데 니가 왜 죽어 개시발년아,욕설
4005,응 문슬람 달창,욕설
4006,치매새끼,욕설
4007,진짜 시발 문재앙 저새끼 최후가 기대된다,욕설
4008,개좆노잼인데 왜웃노?;;,욕설
4009,"""일베개씨발운영진애미뒤진씹창새끼들",욕설
4010,"짱깨돈후장으로받아먹음""",욕설
4011,존나 지겨운 뻘글 ㅁㅈㅎ,욕설
4012,아직도 문재인 응딩이 붙은 병신들 많네,욕설
4013,좌파들이 시체 팔이 하는 거 봐라. 장담한다,욕설
4014,이세끼도 짱깨 돈받아쳐먹었냐?? 사람세끼아님,욕설
4015,나라국 신경쓰다 애를 놓친 ㅂㅅ조선족,욕설
4016,쟤 하나로 우리 국격까지 좆병신되는건데,욕설
4017,봉준호 병신새끼,욕설
4018,문빠 개돼지들은 저 여기자 왜 욕함???,욕설
4019,민심 완전 등돌리고 문재앙 지지율 폭락하지 오히려 일부러 저런거 아닐까 싶을 정도구만,욕설
4020,선거라도 잘하자 하.. 시발..,욕설
4021,허세로 가득찬 김치년 김치남새끼들이 꼭 봐라,욕설
4022,한걸레 아니랄까봐 걸레같이 씨부리노,욕설
4023,하 씨발 일베새끼들도 아는걸 왜 귀막고 안듣노,욕설
4024,주변이 종북이 아니라 저새끼가 종북이야,욕설
4025,"진짜 안보관 반도 1등 개씹 ㅄ 좆경두랑은 차원이 다름""",욕설
4026,문재앙때문에 돈 없어서 새 차는 무슨 차 수리비도 빠슷한 상황임,욕설
4027,"그런 사람 나와서 좌빨역적새끼들 다 처형시켜야 이 나라가 산다""",욕설
4028,대단한새끼ㅋㅋㅋㅇㅂ,욕설
4029,야인시대 눈물의 곡절 그새끼같노 ㅋㅋㅋ,욕설
4030,재인아 이대로만 가자 진짜 개좆같은 세상 다같이 망했으면 좋겠다,욕설
4031,쩌뚱이 새끼 얼굴에 능욕뼁끼칠하고 인증하면 천베는 갈듯,욕설
4032,이색기 간첩죄로 체포하고나면 자살못하게 꽁꽁 묶어라.,욕설
4033,문재앙 저색기 출생 조사 다시해봐야한다,욕설
4034,와 씨발 ㅋㅋㅋㅋ 말투보면 그냥 전형적인 한국년이네 ㅋㅋㅋ,욕설
4035,페도충들 난리났네 역겨운새끼들,욕설
4036,국방부가 관리하는거지 진짜 미필새끼들 존나 많네,욕설
4037,자한당 패한거 좃나게 거론하는 졍신병자 보소.,욕설
4038,규리야 함 주라 내가 일베에서 방패가 되어 주마,욕설
4039,니 보지 앞으로 함 먹고 뒤로 두번 먹고 너도 내꺼 먹고,욕설
4040,살인을 한건 잘못이지만 난 피해자새끼 잘 죽었다 생각 한다,욕설
4041,사람 봐가며 무시하는것 자체가 그새낀 개새끼니까,욕설
4042,민중은개돼지다,욕설
4043,나라가 문재앙 멍청한 정부 병신짓으로 후진국 쓰레기가 되어간다,욕설
4044,캠핑장드립 그년이랑 수준차이,욕설
4045,사형후 후장만 적출해서 줄게,욕설
4046,미쳐도 한방향으로만 미쳐서 젖탱이 내놓고 다니든가 아니면 걸레마냥 홀복처입고 다니지말고,욕설
4047,웃통까고 토플리스로 시위하던 년들이 이제와서 지난 수천년간 지극히 정상적인 상황을 보고 지랄하냐,욕설
4048,아니 씨발 언제는 왜 여자만 브라차고 여자만 상체를 가리냐면서,욕설
4049,좃선일보 좃까고 있네,욕설
4050,와..ㅅㅂ..좆된다 경이롭다,욕설
4051,저새끼는 지재산도 3조라고 말할걸,욕설
4052,턱주가리개새끼 공소시효법 좆같네!,욕설
4053,나는심장이없노 이새끼 아직도 싸우노,욕설
4054,아오 이 씨발 저거 어쨋다고 사골존나우려먹네,욕설
4055,나름 신문사란거 글써논게 무슨 골빈 20대 초반 좌좀년이랑 다를바가 없노,욕설
4056,존나 미개해서 당연히 중국이겠지 생각하고 보다가,욕설
4057,씨발 볼때마다 핸드폰 집어던질뻔.,욕설
4058,보지 자궁 적출당했을듯,욕설
4059,나도 홍어지만 저새끼 고향욕 다 멕이네,욕설
4060,문재앙 죽여야하지않냐? 문재앙 이 ㅅㅋ땜에 우리대한민국 국민 5천만이 북한 볼모 되겠어,욕설
4061,중졸에 미필이면...와... 씨발 와꾸 아니였으면 굶어 죽엇겠다..,욕설
4062,진짜 ㅅㅍ... 서울에 홍어새1키들 ㅈㄴ새끼1까서 ㅈ댄다 걍.,욕설
4063,저래도 이명박근혜 욕할새끼들,욕설
4064,자살하면 영혼이 한이 많아서 저승으로 못가고 떠도는데 존나 춥다더라.자살해도 더 헬임.,욕설
4065,이런 찌질한쉐이 남자망신 다시키네,욕설
4066,건반쟁이 미친새끼네 어따대고 북한새끼들을 국민이래 ㅋㅋㅋ,욕설
4067,양아치 개새끼,욕설
4068,밑에 멍청한놈들 제발사라져지감동받았다는걸 볼맛안나게 스포말해주는 친절한 ㅈㅄ,욕설
4069,"저 피해자가 규정 속도랑 신호를 지켰으면 유세차량운전자가 개새끼고""",욕설
4070,쫀득한질경련 신호랑 과속을 일삼한 배달충들은 노짱 따라가도 싸지,욕설
4071,개씨발 민주화박는 홍어세끼들 문져라 쒸벌넘들,욕설
4072,슨상 면상 봐라. 두번 봐라. 짱개 아니냥?,욕설
4073,닭그네 남편은 어딘노??,욕설
4074,야갤 맞는데 일베충쉑들아? 야갤 사생아 일베수준 www,욕설
4075,존나 좆밥같이 생겼네 짱깨새끼,욕설
4076,개씨발 짱깨조선족 사라지니 ㅁㅈㅎ 수 보소 ㅋㅋㅋ,욕설
4077,아주 씨발 이 악물고 방어하네.,욕설
4078,진짜 저렇게 대놓고 가식적인새끼는 보다보다 첨본다 씨발,욕설
4079,또또또 감성 팔이 시작한다. 좆병신들이 철도 건설하는데 들어가는 투자금 회수하려면30년 걸리는데 잘도 해먹겠다??,욕설
4080,우린 못한다 개대중이 ㅠㅠ,욕설
4081,개독새끼들 대깨문 존나많더만 ㅋㅋ,욕설
4082,세월호는 안산 절라도 씹 거지들이기 때문임,욕설
4083,얼마전에 일베간거 그대로 갖고오네 ㅁㅈㅎ,욕설
4084,노무쿤 무슨책썻냐 ㅡ 운지의 꿈 ㅡ,욕설
4085,개 좆같은 보지민국 빨리 아작나길 바란다,욕설
4086,저 씨팔 역적놈새끼,욕설
4087,개짱깨좆족들,욕설
4088,전라도 뇬덜 특징 : 건방짐,욕설
4089,진짜 시발 나라 꼬라지봐라,욕설
4090,멍청도 새끼들은 저래도 뽑아줌 ㅋㅋㅋㅋㅋㅋㅋㅋㅋㅋㅋㅋㅋㅋㅋㅋ,욕설
4091,아직도 좃세연빠는 개병신틀딱새끼가있네 ㅋㅋㅋㅋㅋ,욕설
4092,ㅋㅋㅋㅋ애미터졌노,욕설
4093,문재인씨발름,욕설
4094,시발ㅋㅋ 행게이는 ㅇㅂ야,욕설
4095,뭘 좆대 씨발 말만 ㅁㅈㅎ,욕설
4096,어휴 저 씨발 개병신 애북자 북무새 씹새끼.,욕설
4097,막짤 존나 약해보이네 ㅋㅋㅋㅋㅋㅋ,욕설
4098,진짜 시발 너무한다 너무하,욕설
4099,조옷같네 진짜 ㅋㅋㅋ,욕설
4100,미친년들 같은 한표라니,욕설
4101,찌질하네 개새끼,욕설
4102,지랄을 한다 병신 홍어새끼야,욕설
4103,니애미는영등포홍등가에잇단다,욕설
4104,Iq추적 당하면좆대는거아님??ㅋㅋ,욕설
4105,ㅋㅋㅋㅋㅇㅂ 시발년아!!,욕설
4106,이새끼 건강하네 ㅋㅋㅋㅋㅋㅋ,욕설
4107,6번짤 존나 우끼네,욕설
4108,전라도는 꼬추달린ㅅㄲ들만 문제,욕설
4109,크~ 좆나 멋지네,욕설
4110,개병신들 많네 ㅋㅋ,욕설
4111,세스코ㅋㅋㅋㅋㅋ짱퀴퇴치 ㅇㅂ,욕설
4112,우와 시발 토나오네 ㄹㅇ,욕설
4113,전라도 변태 새끼들ㅋㅋ 자지가 뇌를 지배해 버렸노,욕설
4114,병신들아 저 차를 멋으로 타는 병신이 있다고 생각하냐?,욕설
4115,유촉새 저 병@새@ ㅋㅋㅋㅋㅋㅋㅋㅋㅋ,욕설
4116,진짜 개새끼야,욕설
4117,시발 미쳤네,욕설
4118,쾅주출신이구마잉 암 그라제잉,욕설
4119,즙 존나 짜네 ㅋㅋ 어휴 씨발,욕설
4120,일베불고렙 시밯ㅋㅋㅋㅋㅋㅋㅋㅋㅋㅋㅋㅋㅋ,욕설
4121,ㅋㅋ 그냥 병신들이야,욕설
4122,우병우 쥬지 빨고싶엉,욕설
4123,지겨워 죽겠다 씨발,욕설
4124,전라도 부모새끼들 ㅋㅋㅋㅋㅋ,욕설
4125,뒤질랜드 시발럼어딨냐,욕설
4126,솔까 좆무륵 할듯,욕설
4127,진짜 개씨발놈들이다 ㅋㅋㅋㅋㅋㅋㅋㅋㅋㅋㅋㅋㅋㅋㅋ,욕설
4128,문재앙 씹새끼야 전라도로 쳐 넣으라고 시발,욕설
4129,씨발ㅋㅋㅋㅋㅋ 모세랑 박았노 이깈ㅋㅋㅋ,욕설
4130,하지마 병신아,욕설
4131,존나 알뜰살뜰하네 씨발년이 ㅋㅋㅋ,욕설
4132,이 개무식한 병신 새끼가 뭐래냐?,욕설
4133,뭐하는 개새끼인데 욕부터 쳐하고 지랄이야.,욕설
4134,전라도기생충들 학살이답이다,욕설
4135,간잽이 십색히,욕설
4136,예수새끼야 보고 있노?,욕설
4137,진짜 좋게봤는데 개 씨발 역겨운저질새끼네 ㅋㅋ,욕설
4138,ㅋㅋㅋㅋㅋㅋ 미친새끼 존나 웃기노,욕설
4139,쓸모없는 한국피싸개ㅎㅎ 죗값을치르리라,욕설
4140,보지난민이 많이오면 몰라도 자지투성인데 환호하네,욕설
4141,씨발 똥꼬충도 아니고,욕설
4142,"""저 씹도 못팔년 저거 달창년이네 저거",욕설
4143,보지를 면도칼로 벌집보지를 만들고,욕설
4144,염산을 뿌려 숙성시켜,욕설
4145,홍어사료로 쓰고싶노,욕설
4146,"개갈보지년""",욕설
4147,남자 똥꼬냄새를 향기라고 생각해라,욕설
4148,보지둥절 여성을 위장한 괴물이 있을뿐...,욕설
4149,김치년들은 그냥 집에 짜져있어야됨,욕설
4150,저년은 보지가 얼마나 헐어있을까?,욕설
4151,문준용애미 느그애미 보지 개 참새보지 닭보지 문재앙 김정은 시진핑 좆집ㅋㅋㅋㅋㅋㅋㅋㅋㅋ,욕설
4152,박정희좆집에다가 아주 동네방네 씹걸레 ㅋㅋㅋㅋ,욕설
4153,도태된건 피싸개년들이지 ㅋㅋ 한국남자는 동남아만가도 ㅎㅌㅊ가 ㅅㅌㅊ됨,욕설
4154,보지털리게 냅둬,욕설
4155,겐진 그새끼섹스하는게 젤노잼임,욕설
4156,골든샤워와 애널 섹스 ㄷㄷㄷ,욕설
4157,병신년들 보지값 떨어질까봐 기를쓰고 막네 ㅋㅋ,욕설
4158,지각 새끼도 섹스를하는데..,욕설
4159,저년 송씨한테 먹버 당한년 아니냐!,욕설
4160,아 씨발 일베에서 쭉쭉 처빠는거 보니 곧 망하겟네.,욕설
4161,쉰김치 보지냄새 농축액을 대접할듯.,욕설
4162,김치보지년들아,욕설
4163,쟤네들도 밤에는 고추 집어넣고 허리 돌리겠지 ㅗㅜㅑ,욕설
4164,어쩌라구 씨발년들아!!!!!!!!!!!!!,욕설
4165,문재용이 버닝썬에서 섹스해서그럼,욕설
4166,애초에 남자가문제구만 진짜 한남이랑 같이있으면 안꼬이는일이없네ㅋㅋ,욕설
4167,씨발 안경이 그나마 역겨움을 순화시켜주네 좃나 씨발,욕설
4168,미개한 조셴 김치씨발새끼들,욕설
4169,빠순이 된장녀김치녀 맘충메갈,욕설
4170,보지마인드 ㅁㅈㅎ,욕설
4171,아니 씨발 아직도 2년이나 남았냐? 존나 기네 진짜 하..,욕설
4172,한남새끼들은 남성력을 쳐잃어서 3센치죠????엌ㅋㅋ,욕설
4173,봊세지아니라서 ㅆㅁㅈㅎ 보지야,욕설
4174,새보지당 ㅁㅈㅎ,욕설
4175,실장 여자라하는 새끼들 빙시들인가,욕설
4176,스시년 왜 빠나 ㅋㅋㅋㅋ,욕설
4177,막짤 키스하려는거냐 시발,욕설
4178,니그로새끼들은 경찰 말에 순응하는 걸 보지들만 하는거라고 생각해서 그럼,욕설
4179,이봐 대깨문친구 보지잡고반성해,욕설
4180,확실히 스시녀가 김치년들보다 현명하다,욕설
4181,하...가슴이 미어진다... 개대중 씹쌔끼만 아니었어도,욕설
4182,좆밥새끼가 어서 훈계질이노,욕설
4183,저런 부모 가진 여자랑 결혼하면 ㅈ 된다,욕설
4184, ㄹㅇ 이다.,욕설
4185,"""어빠 나 보지가려운데""",욕설
4186,여친이랑 떡 몇번칫노 니 꼬치 크나,욕설
4187,개 좆같은 보지민국 빨리 아작나길 바란다,욕설
4188,보지부터 먼저 먹고싶노,욕설
4189,나빼고섹스는다함.. 개더러운새끼들,욕설
4190,씨발 진짜 야동규제할거면 워마드 메갈도 규제하지,욕설
4191,왜 뚱뚱한 개보지들 설치는 건 쳐놔두냐?,욕설
4192,아 보지들 보표권때문에 그러냐? 니애미씨발 문재인ㅋㅋ,욕설
4193,여자들 카페라고 다 썅년들만 있는건 아니더라,욕설
4194,저놈도 정신병자임.,욕설
4195,남자페미가 아니라 남자 메갈임.,욕설
4196,보지가 주도하는 질서 거역할 수 없어,욕설
4197,나같으면 그년 따먹고 창밖으로 던질거 같은데 안그런거 보면 존못이었겄노,욕설
4198,보빨 하면서 식물남처럼 살며 여성의 선택을 기다려야 함.,욕설
4199, 장애병신년아 그니까 피싸개년들은 직장다니지말고 집에서 밥하고 빨래하고 애나보는게 국가를 위하는길이고 자기한테도 제일 좋은 삶인데,욕설
4200,너같이 지능이 떨어져 주제도 모르는년이 자꾸 직장다닐라고 하고 특혜달라고 하니까 나라가 망하는거다ㅋㅋㅋㅋㅋ,욕설
4201,지들이 좋아서 결혼한다는데 왜 지네들이 지랄이지 ㅋㅋㅋㅋ,욕설
4202,흑발 좋아하는거보니 보지맛을 아는구나,욕설
4203,여자문재인 미국이 한국노조같은거만 있었어도 좆망당핶을듯,욕설
4204,진짜 좆같이도 생겨먹었네,욕설
4205,시발년이 양심에 털이 보지털보다 먼저 난 년이네,욕설
4206,아주 그레이트한 썅년일세,욕설
4207,으아 보지대~,욕설
4208,이새끼 김치잘알 ㅇㅂ,욕설
4209,달창새끼들 경제기사에도 좀 나타나보지 ㅎㅎ,욕설
4210,명품보지 필면되지.,욕설
4211,진짜 ㄹㅇ이다 저따구로해도 걍 윗선에서 덮어줄듯 견찰새끼는 몰래 신분까버리고,욕설
4212,씨발년들 똥통 변기 막히면 남자 부르지마라. 직접 뚫어라.,욕설
4213,정전돼도 직접 고쳐 개년들아,욕설
4214,부자조지고 하향평준화되면 보지년들 아다깨는나이 평균 5살은 줄어들겠노 ㅋㅋㅋㅋㅋ,욕설
4215,이래도 보지년들을 주요 보직에 앉혀도 괜찮은겁니까?!!,욕설
4216,섹스는 잘함?,욕설
4217,군대는 편해지면 안되는 곳이야 빡대가리년아...왜 항상훈련하고 군기를 다잡겠냐? 에미뒤졌냐? 병신년아,욕설
4218,김치년 통짜 골반이네,욕설
4219,미개한 좆트남 갈보년들ㅉㅉ,욕설
4220,그래서 저년이 특전사들이랑 떼씹했다고?,욕설
4221,보지하나로 좆본군인들 걸크러쉬했당께요!!!!!,욕설
4222,보지 홍어년들좀 싸그리 잡아 죽였으면,욕설
4223,화장실인데 죳나 웃음참느라 혼났다 이기ㅋㅋㅋㅋㅇㅂ,욕설
4224,화장안하니까 존나 못생겼네,욕설
4225,걍 여자라는 성별자체가 장애끼 다분한 병신년들인데,욕설
4226,그냥 공공보지 니가 데리고 산다 생각해라,욕설
4227,문재모자이크는 또 뭐냐 시발,욕설
4228,성형했네 개 젖가튼 년들,욕설
4229,존나 상남자네,욕설
4230,보지 말이하는 줄 알고 들어옴 ㅎㅎ,욕설
4231,씨발 달창년 보지에 소방호스 한롤,욕설
4232,꾸역꾸역 처 밀어넣고 수압 존나씨게 해서 물 틀고 싶네,욕설
4233,안봐도 김치년보지아니냐?,욕설
4234,어휴 씨발 도둑놈의 새끼들,욕설
4235,개 씨발년들 일단 나는 무조건 되야 하니께 남자 쌉반대후에 나는 됐으니까 남자채워주쇼 ㅎㄷㄷㄷㄷ,욕설
4236,보지굴비 ㅆㅅㅌㅊ 한수 배웠노,욕설
4237,진짜 보지민국 개좆같네 씨발꺼,욕설
4238,그럼 여자들이 발롱도르 뭔지 모르면 수상자들 다 좆밥???,욕설
4239,보지에 쇄정목꽂았노 ㅎㄷㄷ,욕설
4240,어제 남친이 보지 깊숙히 싸줬나보지,욕설
4241,개따먹고싶다... 미시 코카서스,욕설
4242,여자들 ㅂㅈ 애밉ㅈ 닮는다 유전임,욕설
4243,김치창년 태평양보지들 발악은ㅋ,욕설
4244,꼬박꼬박 빚갚아 나간다고 지랄하던데,욕설
4245,저게 맞지 문재앙 병신새끼야,욕설
4246,만나서 자지로 혼내줘야함,욕설
4247,그때 서현이 보지를 20달러주고 사먹었어야 했네..,욕설
4248,애미 씹가능 결혼도가능,욕설
4249,나도 예쁜여자를 팔다리묶고 산채로 가슴을 톱으로 슥슥잘라내며 고통에 몸부림치는년,욕설
4250,아가리에 망치질을 가해 이빨다깨부시고 입으로 하게한다음,욕설
4251,거꾸로 뒤집어 가랑이부터 대가리까지 슥슥 톱질을해 고통에 경련을 일으키는걸 보며 즐기고싶다...,욕설
4252,용석이 씨발년아 도도맘 보지 따뜻하냐? ㅎ 고소좀~,욕설
4253,다리가 씨발 보지모양이네 오다리샜끼 ㅋㅋㅋㅋㅋ,욕설
4254,하라보지 따라가노 ㅋㅋㅋ,욕설
4255,아들아 저런 애미를 둔 여자는 좆집이다. 결혼하지 말아라,욕설
4256,보지민국인데 아서라,욕설
4257,코가 씨발 자지코노 좃코가지고 있네,욕설
4258,ㅋㅋ차 자랑을 보지같이도했네,욕설
4259,돼씹 공익새키들 저렇게 불성실하게 근무하면 조져야함 ㄹㅇ,욕설
4260,"""내 불알뗄때 좆물 한방울이라도 흘리면 니들자지는 보지로 맹글어준다""",욕설
4261,넘겸마 ㅋㅋㅋㅋㅋㅋㅋㅋㅋㅋㅋㅋㅋㅋ,욕설
4262,이거보고웃으면 ㅈ돼는각임,욕설
4263,이게 나라냐 시발,욕설
4264,미쳤다 시발 ㅋㅋㅋㅋㅋㅋㅋㅋㅋㅋㅋㅋㅋㅋㅋㅋ,욕설
4265,시발 존나 욱기네 ㅋㅋㅋㅋㅋ,욕설
4266,아 쎅쓰하고싶다~,욕설
4267,뭘 좆대 씨발 말만 ㅁㅈㅎ,욕설
4268,어휴 저 씨발 개병신 애북자 북무새 씹새끼.,욕설
4269,와 배우신일게이 ㅇㅂ,욕설
4270,진짜 시발 문재앙 쳐돌았나,욕설
4271,병신들이냐 ㅋㅋ,욕설
4272,진짜 시발 너무한다 너무하,욕설
4273,존나 소름끼친다 ㅋㅋㅋㅋㅋㅋㅋㅋㅋ,욕설
4274,일게이들 제사상보다 ㅅㅌㅊ노ㅋㅋ,욕설
4275,니새끼도 좋아요 눌러서 ㅁㅈㅎ,욕설
4276,설라도새끼들,욕설
4277,100% 문재인찍은새끼임,욕설
4278,찌질하네 개새끼,욕설
4279,전라도는 꼬추달린ㅅㄲ들만 문제,욕설
4280,전라도 변태 새끼들ㅋㅋ 자지가 뇌를 지배해 버렸노,욕설
4281,병신들아 저 차를 멋으로 타는 병신이 있다고 생각하냐?,욕설
4282,즙 존나 짜네 ㅋㅋ 어휴 씨발,욕설
4283,솔까 좆무륵 할듯,욕설
4284,존나 알뜰살뜰하네 씨발년이 ㅋㅋㅋ,욕설
4285,간잽이 십색히,욕설
4286,애는 뭐하는 새끼냐 ㅇㅂ,욕설
4287,븅신새끼들 힘 다빠졌네 ㅋㅋㅋㅋ,욕설
4288,이런 좆같은,욕설
4289,왜 이쁜이들만 죽어? 씨발,욕설
4290,문재인 입에다가 싸고 싶다,욕설
4291,니애미 전라도 창녀,욕설
4292,홍어년한테 걸려부렀노,욕설
4293,그와중에 남자새끼 존나 잘생겼네,욕설
4294,제발 김치년 검증 좀 제대로 하고 결혼해라 씨발것들아,욕설
4295,섹스섹스 보지털,욕설
4296,김치년들은 그냥 집에 짜져있어야됨,욕설
4297,틀딱새끼들은 조현아 밑에서 일할 자신 있나보지? ㅋㅋ,욕설
4298,겐진 그새끼섹스하는게 젤노잼임,욕설
4299,미친 씨8년이네!,욕설
4300,내가 너같이 착한척하는 돼지냄새는 년들을 제일 싫어해,욕설
4301,골든샤워와 애널 섹스 ㄷㄷㄷ,욕설
4302,병신년들 보지값 떨어질까봐 기를쓰고 막네 ㅋㅋ,욕설
4303,지각 새끼도 섹스를하는데..,욕설
4304,아 씨발 일베에서 쭉쭉 처빠는거 보니 곧 망하겟네.,욕설
4305,예상했잖아? 보지민국 하루이틀사냐? ㅋㅋㅋ,욕설
4306,어쩌라구 씨발년들아!!!!!!!!!!!!!,욕설
4307,니애미보지나믿지마라,욕설
4308,필핀보지왜먹누대체,욕설
4309,이 썅년아 ㅋㅋㅋㅋㅋㅋㅋ ㅇㅂ,욕설
4310,씨발 안경이 그나마 역겨움을 순화시켜주네 좃나 씨발,욕설
4311,페미 PC충 새끼들 조만간 남자들이 일으킨 폭동으로 인해 싸그리 몰살 당할 것 같다.,욕설
4312,젊고 이쁜여자들은 북한고위간부 육변기로,욕설
4313,한남새끼들은 남성력을 쳐잃어서 3센치죠????엌ㅋㅋ,욕설
4314,조개속고추 밑에 댓글봐라,욕설
4315,보지가 요직에 앉으면 이런거야.,욕설
4316,봊세지아니라서 ㅆㅁㅈㅎ 보지야,욕설
4317,좆밥상병신새끼2 등판ㅋㅋㅋ,욕설
4318,옆에 있으면 눈깔깔고 처다보지도 못할 븅신새끼가 허세부리는거보소 ㅅㅂㅋㅋ,욕설
4319,니새끼도 홍어랑 동급 ㅂㄹ ^노^,욕설
4320,그래서 결론은 넌 여자친구 만족도 못시켜주고 다른 남자한테 여자 뺏긴 새끼란 거네?,욕설
4321,MBC약자는 문병신이다.,욕설
4322,이봐 대깨문친구 보지잡고반성해,욕설
4323,하...가슴이 미어진다... 개대중 씹쌔끼만 아니었어도,욕설
4324,좆밥새끼가 어서 훈계질이노,욕설
4325,보지년들 재기해! 재기해!,욕설
4326,내가 보빨 존나시러하지만 쯔위정도면,욕설
4327,진짜 성격 개좆같은 새끼 한번 만나서 싸대기 존나 쳐맞아 팅팅 부은 얼굴,욕설
4328,이게 남자새끼들은 사기치거나 먹튀 했을때 군대가면서 잡히더라,욕설
4329,보지부터 먼저 먹고싶노,욕설
4330,남편새끼 일없고 52시간때문에 집에 존나 일찍오고 휴일 다 놀고해서..,욕설
4331,왜 뚱뚱한 개보지들 설치는 건 쳐놔두냐?,욕설
4332,아 보지들 보표권때문에 그러냐? 니애미씨발,욕설
4333,씨발 진짜 야동규제할거면 워마드 메갈도 규제하지,욕설
4334,나빼고섹스는다함.. 개더러운새끼들,욕설
4335,"""나같으면 존나꼴려서",욕설
4336,"보지한번 보여줘 하면서 사람도없는대 팬티까고 불얄흔들었다""",욕설
4337,여자 보지 빨고싶다 진짜 너무,욕설
4338,"""저놈도 정신병자임.",욕설
4339,"남자페미가 아니라 남자 메갈임.""",욕설
4340,아 씨발 지하철에서 웃다가 침튀었다 ㅋㅋㅋㅋㅋ ㅋㅋㅋㅋㅋㅋㅋㅋㅋ,욕설
4341,보빨 하면서 식물남처럼 살며 여성의 선택을 기다려야 함.,욕설
4342,지들이 좋아서 결혼한다는데 왜 지네들이 지랄이지 ㅋㅋㅋㅋ,욕설
4343,"""진짜 좆같이도 생겨먹었네",욕설
4344,시발년이 양심에 털이 보지털보다 먼저 난 년이네,욕설
4345,"아주 그레이트한 썅년일세""",욕설
4346,이새끼 김치잘알 ㅇㅂ,욕설
4347,한남짜장부랄구름과 한남좆물구름 아니노?,욕설
4348,근대 왜 날쳐다봐 씨발년아 이게더 어울릴듯,욕설
4349,남자 새끼들도 존나 느끼하고,욕설
4350,보지 앞에서는 섹스라는 단어만 꺼내도 인생 운지하는 좆같은 나라,욕설
4351,"""씨발년들 똥통 변기 막히면 남자 부르지마라. 직접 뚫어라.",욕설
4352,"정전돼도 직접 고쳐 개년들아""",욕설
4353,뭐하고있는게냐 저년 보지를 법봉으로 지져 죽여라~!,욕설
4354,이래도 보지년들을 주요 보직에 앉혀도 괜찮은겁니까?!!,욕설
4355,니엠보지홍어보지 ㅋㅋㅋ 깊은 자아성찰 ㅇㅂ,욕설
4356,운지철도999 이런 개무식한 노가다 김씨새끼.,욕설
